{"schemaVersion":"1.0.0","generatedAt":"2026-10-21T04:56:37Z","location":{"name":"Canton","region":"Michigan","latitude":42.3086,"longitude":-83.4824,"timeZone":"America/Detroit"},"current":{"observedAt":"2026-10-21T00:45:00-04:00","temperatureF":44.2,"feelsLikeF":40.7,"conditionCode":0,"conditionText":"Clear","icon":"☀","precipitationIn":0,"humidityPercent":88,"wind":{"speedMph":3.2,"directionDegrees":34,"direction":"NE","gustMph":3.4}},"daily":[{"date":"2026-10-21","highF":66.6,"lowF":39.1,"conditionCode":45,"conditionText":"Fog","icon":"🌫","precipitationChancePercent":0,"sunrise":"2026-10-21T07:53:00-04:00","sunset":"2026-10-21T18:42:00-04:00","narrative":"Fog with a high near 67°F and a low around 39°F; 0% chance of precipitation."},{"date":"2026-10-22","highF":69.6,"lowF":42,"conditionCode":3,"conditionText":"Overcast","icon":"☁","precipitationChancePercent":1,"sunrise":"2026-10-22T07:55:00-04:00","sunset":"2026-10-22T18:40:00-04:00","narrative":"Overcast with a high near 70°F and a low around 42°F; 1% chance of precipitation."},{"date":"2026-10-23","highF":66.3,"lowF":51.3,"conditionCode":0,"conditionText":"Clear","icon":"☀","precipitationChancePercent":0,"sunrise":"2026-10-23T07:56:00-04:00","sunset":"2026-10-23T18:39:00-04:00","narrative":"Clear with a high near 66°F and a low around 51°F; 0% chance of precipitation."},{"date":"2026-10-24","highF":67.6,"lowF":50.8,"conditionCode":3,"conditionText":"Overcast","icon":"☁","precipitationChancePercent":0,"sunrise":"2026-10-24T07:57:00-04:00","sunset":"2026-10-24T18:37:00-04:00","narrative":"Overcast with a high near 68°F and a low around 51°F; 0% chance of precipitation."},{"date":"2026-10-25","highF":69.9,"lowF":51,"conditionCode":3,"conditionText":"Overcast","icon":"☁","precipitationChancePercent":1,"sunrise":"2026-10-25T07:58:00-04:00","sunset":"2026-10-25T18:36:00-04:00","narrative":"Overcast with a high near 70°F and a low around 51°F; 1% chance of precipitation."},{"date":"2026-10-26","highF":66.5,"lowF":54.1,"conditionCode":3,"conditionText":"Overcast","icon":"☁","precipitationChancePercent":9,"sunrise":"2026-10-26T07:59:00-04:00","sunset":"2026-10-26T18:35:00-04:00","narrative":"Overcast with a high near 66°F and a low around 54°F; 9% chance of precipitation."},{"date":"2026-10-27","highF":54.1,"lowF":39.6,"conditionCode":51,"conditionText":"Light drizzle","icon":"🌦","precipitationChancePercent":10,"sunrise":"2026-10-27T08:01:00-04:00","sunset":"2026-10-27T18:33:00-04:00","narrative":"Light drizzle with a high near 54°F and a low around 40°F; 10% chance of precipitation."}],"sources":[{"name":"Open-Meteo","url":"https://api.open-meteo.com/v1/forecast?latitude=42.3086&longitude=-83.4824&current=temperature_2m,apparent_temperature,precipitation,weather_code,relative_humidity_2m,wind_speed_10m,wind_gusts_10m,wind_direction_10m&daily=weather_code,temperature_2m_max,temperature_2m_min,precipitation_probability_max,sunrise,sunset&temperature_unit=fahrenheit&wind_speed_unit=mph&precipitation_unit=inch&timezone=America%2FDetroit&forecast_days=7","retrievedAt":"2026-10-21T04:56:37Z"}]}