{"schemaVersion":"1.0.0","generatedAt":"2026-10-09T20:57:48Z","location":{"name":"Canton","region":"Michigan","latitude":42.3086,"longitude":-83.4824,"timeZone":"America/Detroit"},"current":{"observedAt":"2026-10-09T16:45:00-04:00","temperatureF":69.2,"feelsLikeF":63.2,"conditionCode":0,"conditionText":"Clear","icon":"☀","precipitationIn":0,"humidityPercent":25,"wind":{"speedMph":5,"directionDegrees":243,"direction":"WSW","gustMph":7.6}},"daily":[{"date":"2026-10-09","highF":69.4,"lowF":41.8,"conditionCode":3,"conditionText":"Overcast","icon":"☁","precipitationChancePercent":1,"sunrise":"2026-10-09T07:39:00-04:00","sunset":"2026-10-09T19:01:00-04:00","narrative":"Overcast with a high near 69°F and a low around 42°F; 1% chance of precipitation."},{"date":"2026-10-10","highF":75.3,"lowF":52.6,"conditionCode":3,"conditionText":"Overcast","icon":"☁","precipitationChancePercent":3,"sunrise":"2026-10-10T07:41:00-04:00","sunset":"2026-10-10T18:59:00-04:00","narrative":"Overcast with a high near 75°F and a low around 53°F; 3% chance of precipitation."},{"date":"2026-10-11","highF":63,"lowF":57.6,"conditionCode":63,"conditionText":"Rain","icon":"🌧","precipitationChancePercent":82,"sunrise":"2026-10-11T07:42:00-04:00","sunset":"2026-10-11T18:58:00-04:00","narrative":"Rain with a high near 63°F and a low around 58°F; 82% chance of precipitation."},{"date":"2026-10-12","highF":79.8,"lowF":57.3,"conditionCode":51,"conditionText":"Light drizzle","icon":"🌦","precipitationChancePercent":12,"sunrise":"2026-10-12T07:43:00-04:00","sunset":"2026-10-12T18:56:00-04:00","narrative":"Light drizzle with a high near 80°F and a low around 57°F; 12% chance of precipitation."},{"date":"2026-10-13","highF":67.7,"lowF":55.8,"conditionCode":55,"conditionText":"Heavy drizzle","icon":"🌧","precipitationChancePercent":49,"sunrise":"2026-10-13T07:44:00-04:00","sunset":"2026-10-13T18:55:00-04:00","narrative":"Heavy drizzle with a high near 68°F and a low around 56°F; 49% chance of precipitation."},{"date":"2026-10-14","highF":62.1,"lowF":49.2,"conditionCode":3,"conditionText":"Overcast","icon":"☁","precipitationChancePercent":11,"sunrise":"2026-10-14T07:45:00-04:00","sunset":"2026-10-14T18:53:00-04:00","narrative":"Overcast with a high near 62°F and a low around 49°F; 11% chance of precipitation."},{"date":"2026-10-15","highF":54.6,"lowF":50.6,"conditionCode":61,"conditionText":"Light rain","icon":"🌦","precipitationChancePercent":34,"sunrise":"2026-10-15T07:46:00-04:00","sunset":"2026-10-15T18:51:00-04:00","narrative":"Light rain with a high near 55°F and a low around 51°F; 34% chance of precipitation."}],"sources":[{"name":"Open-Meteo","url":"https://api.open-meteo.com/v1/forecast?latitude=42.3086&longitude=-83.4824&current=temperature_2m,apparent_temperature,precipitation,weather_code,relative_humidity_2m,wind_speed_10m,wind_gusts_10m,wind_direction_10m&daily=weather_code,temperature_2m_max,temperature_2m_min,precipitation_probability_max,sunrise,sunset&temperature_unit=fahrenheit&wind_speed_unit=mph&precipitation_unit=inch&timezone=America%2FDetroit&forecast_days=7","retrievedAt":"2026-10-09T20:57:48Z"}]}