{"schemaVersion":"1.0.0","generatedAt":"2026-10-10T23:36:32Z","location":{"name":"Canton","region":"Michigan","latitude":42.3086,"longitude":-83.4824,"timeZone":"America/Detroit"},"current":{"observedAt":"2026-10-10T19:30:00-04:00","temperatureF":64,"feelsLikeF":62.1,"conditionCode":3,"conditionText":"Overcast","icon":"☁","precipitationIn":0,"humidityPercent":60,"wind":{"speedMph":4.5,"directionDegrees":99,"direction":"E","gustMph":11.9}},"daily":[{"date":"2026-10-10","highF":72.8,"lowF":54.9,"conditionCode":3,"conditionText":"Overcast","icon":"☁","precipitationChancePercent":3,"sunrise":"2026-10-10T07:41:00-04:00","sunset":"2026-10-10T18:59:00-04:00","narrative":"Overcast with a high near 73°F and a low around 55°F; 3% chance of precipitation."},{"date":"2026-10-11","highF":65,"lowF":58.4,"conditionCode":53,"conditionText":"Drizzle","icon":"🌦","precipitationChancePercent":30,"sunrise":"2026-10-11T07:42:00-04:00","sunset":"2026-10-11T18:58:00-04:00","narrative":"Drizzle with a high near 65°F and a low around 58°F; 30% chance of precipitation."},{"date":"2026-10-12","highF":80.7,"lowF":58.3,"conditionCode":51,"conditionText":"Light drizzle","icon":"🌦","precipitationChancePercent":15,"sunrise":"2026-10-12T07:43:00-04:00","sunset":"2026-10-12T18:56:00-04:00","narrative":"Light drizzle with a high near 81°F and a low around 58°F; 15% chance of precipitation."},{"date":"2026-10-13","highF":84.5,"lowF":63.9,"conditionCode":51,"conditionText":"Light drizzle","icon":"🌦","precipitationChancePercent":25,"sunrise":"2026-10-13T07:44:00-04:00","sunset":"2026-10-13T18:55:00-04:00","narrative":"Light drizzle with a high near 84°F and a low around 64°F; 25% chance of precipitation."},{"date":"2026-10-14","highF":66.1,"lowF":53.3,"conditionCode":3,"conditionText":"Overcast","icon":"☁","precipitationChancePercent":13,"sunrise":"2026-10-14T07:45:00-04:00","sunset":"2026-10-14T18:53:00-04:00","narrative":"Overcast with a high near 66°F and a low around 53°F; 13% chance of precipitation."},{"date":"2026-10-15","highF":62,"lowF":48.8,"conditionCode":3,"conditionText":"Overcast","icon":"☁","precipitationChancePercent":41,"sunrise":"2026-10-15T07:46:00-04:00","sunset":"2026-10-15T18:51:00-04:00","narrative":"Overcast with a high near 62°F and a low around 49°F; 41% chance of precipitation."},{"date":"2026-10-16","highF":65,"lowF":47.4,"conditionCode":81,"conditionText":"Rain showers","icon":"🌧","precipitationChancePercent":41,"sunrise":"2026-10-16T07:47:00-04:00","sunset":"2026-10-16T18:50:00-04:00","narrative":"Rain showers with a high near 65°F and a low around 47°F; 41% chance of precipitation."}],"sources":[{"name":"Open-Meteo","url":"https://api.open-meteo.com/v1/forecast?latitude=42.3086&longitude=-83.4824&current=temperature_2m,apparent_temperature,precipitation,weather_code,relative_humidity_2m,wind_speed_10m,wind_gusts_10m,wind_direction_10m&daily=weather_code,temperature_2m_max,temperature_2m_min,precipitation_probability_max,sunrise,sunset&temperature_unit=fahrenheit&wind_speed_unit=mph&precipitation_unit=inch&timezone=America%2FDetroit&forecast_days=7","retrievedAt":"2026-10-10T23:36:32Z"}]}