{"schemaVersion":"1.0.0","generatedAt":"2026-10-16T19:34:38Z","location":{"name":"Canton","region":"Michigan","latitude":42.3086,"longitude":-83.4824,"timeZone":"America/Detroit"},"current":{"observedAt":"2026-10-16T15:30:00-04:00","temperatureF":52.7,"feelsLikeF":47,"conditionCode":61,"conditionText":"Light rain","icon":"🌦","precipitationIn":0.024,"humidityPercent":80,"wind":{"speedMph":11.5,"directionDegrees":356,"direction":"N","gustMph":21}},"daily":[{"date":"2026-10-16","highF":68,"lowF":43.5,"conditionCode":63,"conditionText":"Rain","icon":"🌧","precipitationChancePercent":53,"sunrise":"2026-10-16T07:47:00-04:00","sunset":"2026-10-16T18:50:00-04:00","narrative":"Rain with a high near 68°F and a low around 44°F; 53% chance of precipitation."},{"date":"2026-10-17","highF":50.8,"lowF":34.5,"conditionCode":2,"conditionText":"Partly cloudy","icon":"⛅","precipitationChancePercent":1,"sunrise":"2026-10-17T07:49:00-04:00","sunset":"2026-10-17T18:48:00-04:00","narrative":"Partly cloudy with a high near 51°F and a low around 34°F; 1% chance of precipitation."},{"date":"2026-10-18","highF":61.1,"lowF":36.8,"conditionCode":0,"conditionText":"Clear","icon":"☀","precipitationChancePercent":0,"sunrise":"2026-10-18T07:50:00-04:00","sunset":"2026-10-18T18:47:00-04:00","narrative":"Clear with a high near 61°F and a low around 37°F; 0% chance of precipitation."},{"date":"2026-10-19","highF":65.7,"lowF":43.9,"conditionCode":0,"conditionText":"Clear","icon":"☀","precipitationChancePercent":0,"sunrise":"2026-10-19T07:51:00-04:00","sunset":"2026-10-19T18:45:00-04:00","narrative":"Clear with a high near 66°F and a low around 44°F; 0% chance of precipitation."},{"date":"2026-10-20","highF":66.7,"lowF":49.8,"conditionCode":0,"conditionText":"Clear","icon":"☀","precipitationChancePercent":0,"sunrise":"2026-10-20T07:52:00-04:00","sunset":"2026-10-20T18:43:00-04:00","narrative":"Clear with a high near 67°F and a low around 50°F; 0% chance of precipitation."},{"date":"2026-10-21","highF":63.2,"lowF":50.2,"conditionCode":0,"conditionText":"Clear","icon":"☀","precipitationChancePercent":0,"sunrise":"2026-10-21T07:53:00-04:00","sunset":"2026-10-21T18:42:00-04:00","narrative":"Clear with a high near 63°F and a low around 50°F; 0% chance of precipitation."},{"date":"2026-10-22","highF":67,"lowF":48.3,"conditionCode":0,"conditionText":"Clear","icon":"☀","precipitationChancePercent":3,"sunrise":"2026-10-22T07:55:00-04:00","sunset":"2026-10-22T18:40:00-04:00","narrative":"Clear with a high near 67°F and a low around 48°F; 3% chance of precipitation."}],"sources":[{"name":"Open-Meteo","url":"https://api.open-meteo.com/v1/forecast?latitude=42.3086&longitude=-83.4824&current=temperature_2m,apparent_temperature,precipitation,weather_code,relative_humidity_2m,wind_speed_10m,wind_gusts_10m,wind_direction_10m&daily=weather_code,temperature_2m_max,temperature_2m_min,precipitation_probability_max,sunrise,sunset&temperature_unit=fahrenheit&wind_speed_unit=mph&precipitation_unit=inch&timezone=America%2FDetroit&forecast_days=7","retrievedAt":"2026-10-16T19:34:38Z"}]}